vendor_id,benefit
arctic_wolf_we_make_security_work,the likelihood of insurability
arctic_wolf_we_make_security_work,Attack FrequencyIncident Response JumpStart RetainerLock in a 1-hour response time and preferred rates from an insurance-approved IR team
arctic_wolf_we_make_security_work,your cyber insurance risk profile
arctic_wolf_we_make_security_work,"cybersecurity practices, and creates a common language for internal and external communication of cybersecurity issues"
arctic_wolf_we_make_security_work,ransom demands
arctic_wolf_we_make_security_work,"accessibility to cyber protection, including our award-winningLog4Shell Deep Scan Tool"
arctic_wolf_we_make_security_work,your cyber risk while improving your security posture
arctic_wolf_we_make_security_work,"your risk profile, increase the likelihood of insurability, and potentially lower your rates"
arctic_wolf_we_make_security_work,ransom demands and quicken the speed of recovery efforts
arctic_wolf_we_make_security_work,"risk, and transform how you protect your organization"
arctic_wolf_we_make_security_work,MSP CybersecurityMSPs are in a unique position to protect their clients with strong cybersecurity services
arctic_wolf_we_make_security_work,your customers’ overall posture
arctic_wolf_we_make_security_work,service performance and to learn about visitors to the Arctic Wolf website(s)
arctic_wolf_we_make_security_work,their security posture
arctic_wolf_we_make_security_work,their cyber risk
arctic_wolf_we_make_security_work,"the impact of a potential security incident, our team of 24×7 IR experts respond quickly to contain the threat"
arctic_wolf_we_make_security_work,"ransom demands and speed up recovery, while supporting our digital forensics teams"
arctic_wolf_we_make_security_work,their risk profile and improve their insurability​
arctic_wolf_we_make_security_work,Risk and Understand Insurability with Cyber JumpStartStart your security journey today for freeGet actionable guidance on how to strengthen your cyber resilience and improve your cyber insurability
arctic_wolf_we_make_security_work,cyber risk exposure
